HK0000130705,FS0000A6M6,CUAM China-Hong Kong Strategy Fund A,汇添富中港策略基金 A,HKD,HKD,0,1,11,1,-0.83,1.09,-0.1573,-0.1573,0.1389,0.2345,,1.02096,0.00877,5,,2015/4/17,10000,1000,China Universal Asset Management (Hong Kong) Company Limited,,,"CUAM China-Hong Kong Strategy Fund seeks to achieve medium to long-term capital growth, using bottom-up research approach to invest in a portfolio of equity securities issued by companies which are established in Greater China or derive the majority of their revenue from business or operations relating to Greater China (""Greater China Companies""). Business or operations relating to Greater China include, but are not limited to, direct investment in Greater China or trade involving Greater China.",汇添富中港策略基金透过主要投资于在大中华区成立的公司或其收入、收益、资产、经济活动、业务 或运作与大中华区有关的公司的证券，寻求达致中长期资本增长。,https://doc.morningstar.com/LatestDoc.aspx?clientid=magnumhk&key=4e7d32ed0acb6ed9&language=451&investmentid=F00000PZPJ&documenttype=52&market=1447&investmenttype=1,https://doc.morningstar.com/LatestDoc.aspx?clientid=magnumhk&key=4e7d32ed0acb6ed9&language=451&investmentid=F00000PZPJ&documenttype=76&market=1447&investmenttype=1,https://doc.morningstar.com/LatestDoc.aspx?clientid=magnumhk&key=4e7d32ed0acb6ed9&language=451&investmentid=F00000PZPJ&documenttype=4&market=1447&investmenttype=1,https://doc.morningstar.com/LatestDoc.aspx?clientid=magnumhk&key=4e7d32ed0acb6ed9&language=451&investmentid=F00000PZPJ&documenttype=5&market=1447&investmenttype=1,https://doc.morningstar.com/LatestDoc.aspx?clientid=magnumhk&key=4e7d32ed0acb6ed9&language=451&investmentid=F00000PZPJ&documenttype=1&market=1447&investmenttype=1,6,29,8,23,8,,2020/12/31,0.03,EUCA000504,2022/1/4
HK0000151891,FS00008Z98,JPMorgan Asia Equity Dividend (mth) - USD,摩根亚洲股息(美元)(每月派息),USD,USD,0,1,10,1,0.98,0.57,-0.071,-0.2492,0.0921,0.1768,M$,3.42171,0.03603,3,1268183152,2013/5/31,2000,2000,JPMorgan Funds (Asia) Limited,摩根基金（亚洲）有限公司,,To aim to provide income and long term capital growth by investing primarily in equity securities of companies in the Asia Pacific region (excluding Japan) that the investment manager expects to pay dividends.,"本基金之投资目标为通过主要投资于亚太区(日本除外)内的、投资管理人预期会派发股息的公司的股票, 以提供收益及长期资本增长。",https://doc.morningstar.com/LatestDoc.aspx?clientid=magnumhk&key=4e7d32ed0acb6ed9&language=446&investmentid=F00000Q1ZG&documenttype=52&market=1447&investmenttype=1,https://doc.morningstar.com/LatestDoc.aspx?clientid=magnumhk&key=4e7d32ed0acb6ed9&language=446&investmentid=F00000Q1ZG&documenttype=76&market=1447&investmenttype=1,https://doc.morningstar.com/LatestDoc.aspx?clientid=magnumhk&key=4e7d32ed0acb6ed9&language=451&investmentid=F00000Q1ZG&documenttype=4&market=1447&investmenttype=1,https://doc.morningstar.com/LatestDoc.aspx?clientid=magnumhk&key=4e7d32ed0acb6ed9&language=451&investmentid=F00000Q1ZG&documenttype=5&market=1447&investmenttype=1,https://doc.morningstar.com/LatestDoc.aspx?clientid=magnumhk&key=4e7d32ed0acb6ed9&language=446&investmentid=F00000Q1ZG&documenttype=1&market=1447&investmenttype=1,,,,,,0.0182,2020/9/30,0.025,EUCA000918,2022/1/3
HK0000161320,FS0000BK8T,China Universal International Series -CUAM Hong Kong Dollar Bond Fund Class A HKD,汇添富国际系列-汇添富港币债券基金 A HKD,HKD,HKD,0,1,11,2,-1.74,0.44,-0.0335,-0.0335,0.02,0.0216,Q$,,,2,,2015/6/18,10000,1000,China Universal Asset Management (Hong Kong) Company Limited,,,"The CUAM Hong Kong Dollar Bond Fund (the ""Fund"") seeks to provide investors with a stable and consistent investment return overmedium to long term by investing primarily in Hong Kong Dollar denominated debt securities instruments. The Fund will invest more than 70% of its assets in Hong Kong Dollar denominated debt securities and certificates of deposits, and not more than 30% of its assets in other currency denominated debt securities.",汇添富港币债券基金透过主要投资于港元计价债务证券工具，寻求向投资者提供中长期的稳定及贯彻一致的投资回报。子基金会将其资产70%以上投资于港元计价债务证券及存款证，及将其资产不多于30%投资于其他货币计价债务证券。,https://doc.morningstar.com/LatestDoc.aspx?clientid=magnumhk&key=4e7d32ed0acb6ed9&language=451&investmentid=F00000WHKQ&documenttype=52&market=1447&investmenttype=1,https://doc.morningstar.com/LatestDoc.aspx?clientid=magnumhk&key=4e7d32ed0acb6ed9&language=451&investmentid=F00000WHKQ&documenttype=76&market=1447&investmenttype=1,https://doc.morningstar.com/LatestDoc.aspx?clientid=magnumhk&key=4e7d32ed0acb6ed9&language=451&investmentid=F00000WHKQ&documenttype=4&market=1447&investmenttype=1,https://doc.morningstar.com/LatestDoc.aspx?clientid=magnumhk&key=4e7d32ed0acb6ed9&language=451&investmentid=F00000WHKQ&documenttype=5&market=1447&investmenttype=1,https://doc.morningstar.com/LatestDoc.aspx?clientid=magnumhk&key=4e7d32ed0acb6ed9&language=451&investmentid=F00000WHKQ&documenttype=1&market=1447&investmenttype=1,84,91,92,99,76,,2019/12/31,0.03,EUCA000768,2022/1/4
HK0000181096,FS0000AKP3,Da Cheng China Balanced class A (RMB),大成中国灵活配置基金 A (RMB),CNY,CNY,0,1,11,4,0.53,1.39,-0.0666,-0.0845,0.1011,0.1474,M$,1.77902,0.0157,5,2694062366,2014/3/3,10000,10000,Da Cheng International Asset Mgmt Co Ltd,大成国际资产管理有限公司,,to seek long-term growth of capital and income. The Sub-Fund seeks to achieve its objective through investing directly in fixed income and equity securities issued in China. All investments of the Sub-Fund will be onshore investments in China and will be denominated and settled in RMB.,子基金为平衡型基金，子基金的投资目标为寻求资本及收入长远增长.。,https://doc.morningstar.com/LatestDoc.aspx?clientid=magnumhk&key=4e7d32ed0acb6ed9&language=451&investmentid=F00000SJN8&documenttype=52&market=1447&investmenttype=1,https://doc.morningstar.com/LatestDoc.aspx?clientid=magnumhk&key=4e7d32ed0acb6ed9&language=451&investmentid=F00000SJN8&documenttype=76&market=1447&investmenttype=1,https://doc.morningstar.com/LatestDoc.aspx?clientid=magnumhk&key=4e7d32ed0acb6ed9&language=451&investmentid=F00000SJN8&documenttype=4&market=1447&investmenttype=1,https://doc.morningstar.com/LatestDoc.aspx?clientid=magnumhk&key=4e7d32ed0acb6ed9&language=446&investmentid=F00000SJN8&documenttype=5&market=1447&investmenttype=1,https://doc.morningstar.com/LatestDoc.aspx?clientid=magnumhk&key=4e7d32ed0acb6ed9&language=451&investmentid=F00000SJN8&documenttype=1&market=1447&investmenttype=1,54,3,5,2,3,,2020/12/31,0.0135,EUCA000919,2022/1/3
HK0000181112,FS0000AKP3,Da Cheng China Balanced class A (HKD),大成中国灵活配置基金 A (HKD),HKD,HKD,0,1,11,4,0.52,1.39,-0.0657,-0.0872,0.0992,0.149,M$,1.77902,0.0157,5,3296501589,2014/3/3,12000,12000,Da Cheng International Asset Mgmt Co Ltd,大成国际资产管理有限公司,,to seek long-term growth of capital and income. The Sub-Fund seeks to achieve its objective through investing directly in fixed income and equity securities issued in China. All investments of the Sub-Fund will be onshore investments in China and will be denominated and settled in RMB.,子基金为平衡型基金，子基金的投资目标为寻求资本及收入长远增长.。,https://doc.morningstar.com/LatestDoc.aspx?clientid=magnumhk&key=4e7d32ed0acb6ed9&language=451&investmentid=F00000SJN9&documenttype=52&market=1447&investmenttype=1,https://doc.morningstar.com/LatestDoc.aspx?clientid=magnumhk&key=4e7d32ed0acb6ed9&language=451&investmentid=F00000SJN9&documenttype=76&market=1447&investmenttype=1,https://doc.morningstar.com/LatestDoc.aspx?clientid=magnumhk&key=4e7d32ed0acb6ed9&language=451&investmentid=F00000SJN9&documenttype=4&market=1447&investmenttype=1,https://doc.morningstar.com/LatestDoc.aspx?clientid=magnumhk&key=4e7d32ed0acb6ed9&language=446&investmentid=F00000SJN9&documenttype=5&market=1447&investmenttype=1,https://doc.morningstar.com/LatestDoc.aspx?clientid=magnumhk&key=4e7d32ed0acb6ed9&language=451&investmentid=F00000SJN9&documenttype=1&market=1447&investmenttype=1,52,2,4,3,2,,2020/12/31,0.0135,EUCA000919,2022/1/3
HK0000181138,FS0000AKP3,Da Cheng China Balanced class A (USD),大成中国灵活配置基金 A (USD),USD,USD,0,1,11,4,0.52,1.39,-0.0658,-0.0865,0.0995,0.1498,M$,1.77902,0.0157,5,422853388.5,2014/3/3,1500,1500,Da Cheng International Asset Mgmt Co Ltd,大成国际资产管理有限公司,,to seek long-term growth of capital and income. The Sub-Fund seeks to achieve its objective through investing directly in fixed income and equity securities issued in China. All investments of the Sub-Fund will be onshore investments in China and will be denominated and settled in RMB.,子基金为平衡型基金，子基金的投资目标为寻求资本及收入长远增长.。,https://doc.morningstar.com/LatestDoc.aspx?clientid=magnumhk&key=4e7d32ed0acb6ed9&language=451&investmentid=F00000SJNA&documenttype=52&market=1447&investmenttype=1,https://doc.morningstar.com/LatestDoc.aspx?clientid=magnumhk&key=4e7d32ed0acb6ed9&language=451&investmentid=F00000SJNA&documenttype=76&market=1447&investmenttype=1,https://doc.morningstar.com/LatestDoc.aspx?clientid=magnumhk&key=4e7d32ed0acb6ed9&language=451&investmentid=F00000SJNA&documenttype=4&market=1447&investmenttype=1,https://doc.morningstar.com/LatestDoc.aspx?clientid=magnumhk&key=4e7d32ed0acb6ed9&language=446&investmentid=F00000SJNA&documenttype=5&market=1447&investmenttype=1,https://doc.morningstar.com/LatestDoc.aspx?clientid=magnumhk&key=4e7d32ed0acb6ed9&language=451&investmentid=F00000SJNA&documenttype=1&market=1447&investmenttype=1,53,1,6,4,1,,2020/12/31,0.0135,EUCA000919,2022/1/3
HK0000216926,FS0000B6AK,HSBC Collective Investment Trust - HSBC China Multi-Asset Income Fund AM2 - USD,汇丰中国多元资产入息基金?AM?类?C?美元,USD,USD,0,1,11,4,-1.64,0.44,-0.1974,-0.1974,0.1091,0.1252,M$,1.72635,0.01979,2,812804377.2,2014/11/21,1000,1000,HSBC Investment Funds (HK) Limited,汇丰投资基金（香港）有限公司,,"The Sub-Fund aims to provide income and moderate capital growth, through an active asset allocation in a diversified portfolio of a minimum of 70% of its Net Asset Value in fixed income and equity securities as well as money market and cash instruments that are related to China. For equity portion of the Sub-Fund, the Sub-Fund seeks to invest in China A-Shares and B-Shares listed on stock exchanges in the PRC, H-Shares listed on The Hong Kong Stock Exchange and other China-related shares or securities as well as on other exchanges outside of the PRC, Hong Kong and Macau.",,https://doc.morningstar.com/LatestDoc.aspx?clientid=magnumhk&key=4e7d32ed0acb6ed9&language=446&investmentid=F00000UJ7B&documenttype=52&market=1447&investmenttype=1,https://doc.morningstar.com/LatestDoc.aspx?clientid=magnumhk&key=4e7d32ed0acb6ed9&language=451&investmentid=F00000UJ7B&documenttype=76&market=1447&investmenttype=1,https://doc.morningstar.com/LatestDoc.aspx?clientid=magnumhk&key=4e7d32ed0acb6ed9&language=451&investmentid=F00000UJ7B&documenttype=4&market=1447&investmenttype=1,https://doc.morningstar.com/LatestDoc.aspx?clientid=magnumhk&key=4e7d32ed0acb6ed9&language=451&investmentid=F00000UJ7B&documenttype=5&market=1447&investmenttype=1,https://doc.morningstar.com/LatestDoc.aspx?clientid=magnumhk&key=4e7d32ed0acb6ed9&language=451&investmentid=F00000UJ7B&documenttype=1&market=1447&investmenttype=1,67,95,91,91,77,0.015,2021/3/31,0.025,EUCA000919,2022/1/3
HK0000216942,FS0000B6AK,HSBC Collective Investment Trust - HSBC China Multi-Asset Income Fund AM2 - HKD,汇丰中国多元资产入息基金?AM?类?C?港元,HKD,HKD,0,1,11,4,-1.64,0.44,-0.1973,-0.1973,0.109,0.1252,M$,1.72635,0.01979,2,6336866766,2014/11/21,10000,10000,HSBC Investment Funds (HK) Limited,汇丰投资基金（香港）有限公司,,"The Sub-Fund aims to provide income and moderate capital growth, through an active asset allocation in a diversified portfolio of a minimum of 70% of its Net Asset Value in fixed income and equity securities as well as money market and cash instruments that are related to China. For equity portion of the Sub-Fund, the Sub-Fund seeks to invest in China A-Shares and B-Shares listed on stock exchanges in the PRC, H-Shares listed on The Hong Kong Stock Exchange and other China-related shares or securities as well as on other exchanges outside of the PRC, Hong Kong and Macau.",,https://doc.morningstar.com/LatestDoc.aspx?clientid=magnumhk&key=4e7d32ed0acb6ed9&language=446&investmentid=F00000UJ7A&documenttype=52&market=1447&investmenttype=1,https://doc.morningstar.com/LatestDoc.aspx?clientid=magnumhk&key=4e7d32ed0acb6ed9&language=451&investmentid=F00000UJ7A&documenttype=76&market=1447&investmenttype=1,https://doc.morningstar.com/LatestDoc.aspx?clientid=magnumhk&key=4e7d32ed0acb6ed9&language=451&investmentid=F00000UJ7A&documenttype=4&market=1447&investmenttype=1,https://doc.morningstar.com/LatestDoc.aspx?clientid=magnumhk&key=4e7d32ed0acb6ed9&language=451&investmentid=F00000UJ7A&documenttype=5&market=1447&investmenttype=1,https://doc.morningstar.com/LatestDoc.aspx?clientid=magnumhk&key=4e7d32ed0acb6ed9&language=451&investmentid=F00000UJ7A&documenttype=1&market=1447&investmenttype=1,65,94,90,90,75,0.015,2021/3/31,0.025,EUCA000919,2022/1/3
HK0000252152,FS0000D6WK,E Fund Selection Investment Series - E Fund (HK) China Equity Dividend Fund A HKD Acc,易方达(香港)中国股票股息基金A HKD Acc,HKD,HKD,0,1,11,1,-1.4,0.76,-0.2422,-0.2422,0.1608,0.2197,,1.38047,0.01004,4,,2017/12/29,10000,10000,"E Fund Management (HK) Co., Ltd",易方达资产管理 (香港) 有限公司,,"E Fund China Equity Dividend Fund seeks to achieve long-term capital appreciation primarily through equity-based investments in equity and equity-related securities of companies which are incorporated in, have their area of primary activity in or are related to the growth of China’s economy and are expected to achieve high dividend returns.",,https://doc.morningstar.com/LatestDoc.aspx?clientid=magnumhk&key=4e7d32ed0acb6ed9&language=451&investmentid=F00000ZMYU&documenttype=52&market=1447&investmenttype=1,https://doc.morningstar.com/LatestDoc.aspx?clientid=magnumhk&key=4e7d32ed0acb6ed9&language=451&investmentid=F00000ZMYU&documenttype=76&market=1447&investmenttype=1,https://doc.morningstar.com/LatestDoc.aspx?clientid=magnumhk&key=4e7d32ed0acb6ed9&language=451&investmentid=F00000ZMYU&documenttype=4&market=1447&investmenttype=1,https://doc.morningstar.com/LatestDoc.aspx?clientid=magnumhk&key=4e7d32ed0acb6ed9&language=451&investmentid=F00000ZMYU&documenttype=5&market=1447&investmenttype=1,https://doc.morningstar.com/LatestDoc.aspx?clientid=magnumhk&key=4e7d32ed0acb6ed9&language=451&investmentid=F00000ZMYU&documenttype=1&market=1447&investmenttype=1,38,54,53,76,33,,2020/12/31,0.03,EUCA000504,2022/1/3
HK0000252160,FS0000D6WK,E Fund Selection Investment Series - E Fund (HK) China Equity Dividend Fund A HKD Inc,易方达(香港)中国股票股息基金A HKD Inc,HKD,HKD,0,1,11,1,-1.5,0.73,-0.2541,-0.2541,0.1602,0.2204,M$,1.38047,0.01004,4,,2015/11/16,10000,10000,"E Fund Management (HK) Co., Ltd",易方达资产管理 (香港) 有限公司,,"E Fund China Equity Dividend Fund seeks to achieve long-term capital appreciation primarily through equity-based investments in equity and equity-related securities of companies which are incorporated in, have their area of primary activity in or are related to the growth of China’s economy and are expected to achieve high dividend returns.",,https://doc.morningstar.com/LatestDoc.aspx?clientid=magnumhk&key=4e7d32ed0acb6ed9&language=451&investmentid=F00000YSW0&documenttype=52&market=1447&investmenttype=1,https://doc.morningstar.com/LatestDoc.aspx?clientid=magnumhk&key=4e7d32ed0acb6ed9&language=451&investmentid=F00000YSW0&documenttype=76&market=1447&investmenttype=1,https://doc.morningstar.com/LatestDoc.aspx?clientid=magnumhk&key=4e7d32ed0acb6ed9&language=451&investmentid=F00000YSW0&documenttype=4&market=1447&investmenttype=1,https://doc.morningstar.com/LatestDoc.aspx?clientid=magnumhk&key=4e7d32ed0acb6ed9&language=451&investmentid=F00000YSW0&documenttype=5&market=1447&investmenttype=1,https://doc.morningstar.com/LatestDoc.aspx?clientid=magnumhk&key=4e7d32ed0acb6ed9&language=451&investmentid=F00000YSW0&documenttype=1&market=1447&investmenttype=1,46,71,63,85,35,,2020/12/31,0.03,EUCA000504,2022/1/3
HK0000264884,FSUSA08DY0,Value Partners Classic Fund C Units USD,惠理价值基金 -C Unit,USD,USD,0,1,11,1,-0.36,0.92,-0.1504,-0.1779,0.1716,0.2016,,1.75963,0.01507,3,1519787793,2009/10/15,10000,5000,Value Partners Hong Kong Limited,惠理基金管理香港有限公司,,"The Fund aims to achieve consistent superior returns through an investment discipline that places emphasis on the fundamental value of potential investments, which the Manager believes are being traded at deep discounts to their intrinsic values. The Fund will concentrate on investing in the markets of the Asia Pacific region (particularly in Greater China region) but without fixed geographical, sectoral or industry weightings.",本基金旨在从基本因素分析具升值潜质的投资项目，挑选其市值相对其内在价值而言有重大折让的股票，从而达致持续理想回报。本基金将会集中投资亚太区股市（尤其大中华地区），但并无地域性、领域性或行业性比重限制。,https://doc.morningstar.com/LatestDoc.aspx?clientid=magnumhk&key=4e7d32ed0acb6ed9&language=446&investmentid=F000005F03&documenttype=52&market=1447&investmenttype=1,https://doc.morningstar.com/LatestDoc.aspx?clientid=magnumhk&key=4e7d32ed0acb6ed9&language=451&investmentid=F000005F03&documenttype=76&market=1447&investmenttype=1,https://doc.morningstar.com/LatestDoc.aspx?clientid=magnumhk&key=4e7d32ed0acb6ed9&language=451&investmentid=F000005F03&documenttype=4&market=1447&investmenttype=1,https://doc.morningstar.com/LatestDoc.aspx?clientid=magnumhk&key=4e7d32ed0acb6ed9&language=451&investmentid=F000005F03&documenttype=5&market=1447&investmenttype=1,https://doc.morningstar.com/LatestDoc.aspx?clientid=magnumhk&key=4e7d32ed0acb6ed9&language=451&investmentid=F000005F03&documenttype=1&market=1447&investmenttype=1,58,74,58,48,49,,2020/12/31,0.02,EUCA000500,2022/1/4
HK0000283223,FS0000CEBP,Da Cheng Overseas China Concept Fund A HKD,大成海外中国概念基金 A 港币,HKD,HKD,0,1,11,1,-1.01,0.84,-0.2486,-0.2486,0.1961,0.2071,a$,0.6268,0.00503,4,193569589.3,2016/3/21,10000,10000,Da Cheng International Asset Mgmt Co Ltd,大成国际资产管理有限公司,,"The objective of the Sub-Fund is to achieve long-term capital growth in the value of assets by investing in companies which the Manager believes will benefit from the economic growth and development of China. The Sub-Fund will seek to achieve its investment objective by primarily investing in China Concept Stocks (as defined below), which are listed on stock exchanges outside the People’s Republic of China (the “PRC”).",子基金的目标为透过投资于经理人相信能自中国经济增长及发展中获益的公司，达致资产价值长远资本增长。子基金透过主要投资于中国概念股(定义见下文)(于中华人民共和国(「中国」)境外交易所上市)，寻求达致其投资目标。,https://doc.morningstar.com/LatestDoc.aspx?clientid=magnumhk&key=4e7d32ed0acb6ed9&language=451&investmentid=F00000WXET&documenttype=52&market=1447&investmenttype=1,https://doc.morningstar.com/LatestDoc.aspx?clientid=magnumhk&key=4e7d32ed0acb6ed9&language=451&investmentid=F00000WXET&documenttype=76&market=1447&investmenttype=1,https://doc.morningstar.com/LatestDoc.aspx?clientid=magnumhk&key=4e7d32ed0acb6ed9&language=451&investmentid=F00000WXET&documenttype=4&market=1447&investmenttype=1,https://doc.morningstar.com/LatestDoc.aspx?clientid=magnumhk&key=4e7d32ed0acb6ed9&language=451&investmentid=F00000WXET&documenttype=5&market=1447&investmenttype=1,https://doc.morningstar.com/LatestDoc.aspx?clientid=magnumhk&key=4e7d32ed0acb6ed9&language=451&investmentid=F00000WXET&documenttype=1&market=1447&investmenttype=1,87,91,91,66,32,,2020/12/31,0.015,EUCA000504,2022/1/4
HK0000283249,FS0000CEBP,Da Cheng Overseas China Concept Fund A USD,大成海外中国概念基金 A 美元,USD,USD,0,1,11,1,-1,0.84,-0.2488,-0.2488,0.1968,0.2076,a$,0.6268,0.00503,4,24829824.75,2016/3/21,1000,1000,Da Cheng International Asset Mgmt Co Ltd,大成国际资产管理有限公司,,"The objective of the Sub-Fund is to achieve long-term capital growth in the value of assets by investing in companies which the Manager believes will benefit from the economic growth and development of China. The Sub-Fund will seek to achieve its investment objective by primarily investing in China Concept Stocks (as defined below), which are listed on stock exchanges outside the People’s Republic of China (the “PRC”).",子基金的目标为透过投资于经理人相信能自中国经济增长及发展中获益的公司，达致资产价值长远资本增长。子基金透过主要投资于中国概念股(定义见下文)(于中华人民共和国(「中国」)境外交易所上市)，寻求达致其投资目标。,https://doc.morningstar.com/LatestDoc.aspx?clientid=magnumhk&key=4e7d32ed0acb6ed9&language=451&investmentid=F00000WXEV&documenttype=52&market=1447&investmenttype=1,https://doc.morningstar.com/LatestDoc.aspx?clientid=magnumhk&key=4e7d32ed0acb6ed9&language=451&investmentid=F00000WXEV&documenttype=76&market=1447&investmenttype=1,https://doc.morningstar.com/LatestDoc.aspx?clientid=magnumhk&key=4e7d32ed0acb6ed9&language=451&investmentid=F00000WXEV&documenttype=4&market=1447&investmenttype=1,https://doc.morningstar.com/LatestDoc.aspx?clientid=magnumhk&key=4e7d32ed0acb6ed9&language=451&investmentid=F00000WXEV&documenttype=5&market=1447&investmenttype=1,https://doc.morningstar.com/LatestDoc.aspx?clientid=magnumhk&key=4e7d32ed0acb6ed9&language=451&investmentid=F00000WXEV&documenttype=1&market=1447&investmenttype=1,87,91,92,66,32,,2020/12/31,0.015,EUCA000504,2022/1/4
HK0000284007,FS0000CR48,Bosera-Aberdeen Standard Emerging Opportunities Bond Fund A,博时-安本标准精选新兴市场债券基金 A,USD,USD,0,1,70,2,-1.32,0.01,-0.0649,-0.1475,0.0461,0.0983,A$,,,2,140757179.2,2016/5/9,1000,1000,"Bosera Asset Management(Intl) Co., Ltd.",博时基金(国际)有限公司,,,本基金的投资目标是通过主要投资于全球新兴市场债券及新兴市场货币，以 取得收入及资本增值。概不保证本基金将实现其投资目标。,https://doc.morningstar.com/LatestDoc.aspx?clientid=magnumhk&key=4e7d32ed0acb6ed9&language=446&investmentid=F00000XRC0&documenttype=52&market=1447&investmenttype=1,https://doc.morningstar.com/LatestDoc.aspx?clientid=magnumhk&key=4e7d32ed0acb6ed9&language=451&investmentid=F00000XRC0&documenttype=76&market=1447&investmenttype=1,https://doc.morningstar.com/LatestDoc.aspx?clientid=magnumhk&key=4e7d32ed0acb6ed9&language=451&investmentid=F00000XRC0&documenttype=4&market=1447&investmenttype=1,https://doc.morningstar.com/LatestDoc.aspx?clientid=magnumhk&key=4e7d32ed0acb6ed9&language=451&investmentid=F00000XRC0&documenttype=5&market=1447&investmenttype=1,https://doc.morningstar.com/LatestDoc.aspx?clientid=magnumhk&key=4e7d32ed0acb6ed9&language=451&investmentid=F00000XRC0&documenttype=1&market=1447&investmenttype=1,98,94,91,81,95,,2020/12/31,0.015,EUCA000586,2022/1/3
HK0000284015,FS0000CR48,Bosera-Aberdeen Standard Emerging Opportunities Bond Fund I,博时-安本标准精选新兴市场债券基金 I,USD,USD,0,1,70,2,-1.27,0.06,-0.0628,-0.1471,0.0462,0.0985,A$,,,2,140757179.2,2016/5/9,1000,1000,"Bosera Asset Management(Intl) Co., Ltd.",博时基金(国际)有限公司,,,本基金的投资目标是通过主要投资于全球新兴市场债券及新兴市场货币，以 取得收入及资本增值。概不保证本基金将实现其投资目标。,https://doc.morningstar.com/LatestDoc.aspx?clientid=magnumhk&key=4e7d32ed0acb6ed9&language=446&investmentid=F00000XRC2&documenttype=52&market=1447&investmenttype=1,https://doc.morningstar.com/LatestDoc.aspx?clientid=magnumhk&key=4e7d32ed0acb6ed9&language=451&investmentid=F00000XRC2&documenttype=76&market=1447&investmenttype=1,https://doc.morningstar.com/LatestDoc.aspx?clientid=magnumhk&key=4e7d32ed0acb6ed9&language=451&investmentid=F00000XRC2&documenttype=4&market=1447&investmenttype=1,https://doc.morningstar.com/LatestDoc.aspx?clientid=magnumhk&key=4e7d32ed0acb6ed9&language=451&investmentid=F00000XRC2&documenttype=5&market=1447&investmenttype=1,https://doc.morningstar.com/LatestDoc.aspx?clientid=magnumhk&key=4e7d32ed0acb6ed9&language=451&investmentid=F00000XRC2&documenttype=1&market=1447&investmenttype=1,98,94,90,79,93,,2020/12/31,0.0075,EUCA000586,2022/1/3
