IE00B464Q616,FSUSA0AWHJ,PIMCO GIS Asia Strategic Interest Bond Fund E Class USD Income,PIMCO GIS 新兴亚洲债券基金 E Inc,USD,USD,0,1,10,2,-1.19,0.63,-0.0562,-0.0718,0.042,0.0625,M$,,,3,360906352,2010/6/1,1000,,PIMCO Global Advisors (Ireland) Limited,,"Objective The fund aims to maximise the total return on your investment through primarily investing in a range of fixed income securities and instruments, issued by companies or governments from Asian emerging market countries (ex-Japan), using prudent investment management principles. Investment Policy The fund is an actively managed portfolio which aims to achieve its objective by primarily investing in a range of fixed income securities and instruments (which are loans that pay a fixed or variable rate of interest) issued by companies or governments from Asian emerging market countries, ex-Japan (such as Indonesia, China and India). The fund will mainly invest in emerging markets, which in investment terms are those economies that are not as developed. The average portfolio duration of the fund will normally vary within two years (plus or minus) of the duration of the JP Morgan Asia Credit Index based on the investment advisor’s forecast for interest rates. Duration measures the sensitivity of the assets to interest rate risk. The longer the duration, the higher the sensitivity of the funds’ assets to changes in interest rates. The fund may invest in “investment grade” and “non-investment grade” securities. Non-investment grade securities are considered to be more risky, but typically produce a higher level of income. The fund may use derivatives for hedging or as part of its investment strategy. The assets held by the fund may be denominated in a wide variety of currencies. The investment advisor may use foreign exchange and related derivative instruments to hedge or implement currency positions. For full investment objectives and policy details please refer to the fund’s prospectus. Distribution Policy This share class pays out a distribution of any investment income generated by the fund. You may elect for this to be reinvested into the fund. Dealing Day You can buy and sell shares on most working days in Dublin, exceptions to this are more fully described in the fund holiday calendar available from the Administrator.","The primary investment objective of the Fund is to seek to generate attractive and stable income. Long-term capital appreciation is a secondary objective. The Fund will seek to meet its objectives by investing in a broad array of Fixed Income Instruments which in the Investment Advisor’s view typically generate attractive levels of income. The Fund will generally allocate its assets among several investment sectors, which may include (i) high yield and investment grade bonds and other Fixed Income Instruments issued by corporations, governments, their agencies and instrumentalities located in the Asia ex-Japan countries; (ii) bonds and other Fixed Income Instruments issued by corporations, governments and issuers other than set out in (i); (iii) mortgage-related and other assetbacked securities (which are unleveraged); and (iv) foreign currency positions, including currencies of emerging market countries.",新兴亚洲债券基金的投资目标殪斗合审慎投资管理原则的前提下，寻求达致最高水平的总回报。本基金的投资组合包含固定收益工具（其发行机构与设有新兴证券市场的亚洲（日本除外）国家在经济上有连M），以及该等证券的相关衍生工具（其类别於下文详述）及新兴市场货币。本基金可将不多於25%的资a投资於可转换楣杀局と的证券。本基金可无限额投资於非美元计价的固定收益工具及非美元计价的货币持仓。,https://doc.morningstar.com/LatestDoc.aspx?clientid=magnumhk&key=4e7d32ed0acb6ed9&language=446&investmentid=F00000ISKK&documenttype=52&market=1447&investmenttype=1,https://doc.morningstar.com/LatestDoc.aspx?clientid=magnumhk&key=4e7d32ed0acb6ed9&language=446&investmentid=F00000ISKK&documenttype=76&market=1447&investmenttype=1,https://doc.morningstar.com/LatestDoc.aspx?clientid=magnumhk&key=4e7d32ed0acb6ed9&language=451&investmentid=F00000ISKK&documenttype=4&market=1447&investmenttype=1,https://doc.morningstar.com/LatestDoc.aspx?clientid=magnumhk&key=4e7d32ed0acb6ed9&language=451&investmentid=F00000ISKK&documenttype=5&market=1447&investmenttype=1,https://doc.morningstar.com/LatestDoc.aspx?clientid=magnumhk&key=4e7d32ed0acb6ed9&language=451&investmentid=F00000ISKK&documenttype=1&market=1447&investmenttype=1,75,73,70,69,46,0.015,2021/6/30,0.015,EUCA000570,2022/1/6
IE00B5TLWC47,FSUSA08SB2,BNY Mellon Global Funds PLC - BNY Mellon Long-Term Global Equity Fund USD B Acc,纽约梅隆环球股票长线投资基金 美元B股,USD,USD,0,1,90,1,1.42,1.21,-0.0511,-0.176,0.1183,0.1582,,1.18965,0.01087,2,1820417407,2011/10/28,10000,,BNY Mellon Fund Management (Lux) S.A.,纽约梅隆环球管理有限公司,"OBJECTIVE Longterm capital growth by investing in shares (i.e. equities) and similar investments of companies listed or located throughout the world. POLICY The Fund will:invest anywhere in the world;invest in company shares and similar investments;follow a concentrated investment approach typically investing in fewer than 60 company shares;have complete freedom to invest without reference to any benchmark or index; andlimit investment in other collective investment schemes to 10%. The Fund may:invest in emerging markets; andinvest in derivatives (i.e. financial contracts whose value is linked to the expected price movements of an underlying investment) with the aim of reducing the overall costs and/ or risks of the Fund. Recommendation: the Fund may not be appropriate for investors who plan to withdraw their money within five years. Treatment of income: income from investments will be retained within the Fund. This will increase the value of your shares. Dealing: you can buy and sell your shares in the Fund between 9:00 and 17:00 (Irish time) on each working day in Ireland. Instructions received before 12:00 will receive the price quoted on that day. The minimum initial investment for this share class is USD 10,000.",The objective of the Sub-Fund is to achieve long-term capital appreciation through investing primarily (meaning at least three-quarters of the Sub-Fund’s total assets) in a portfolio of equity and equity related securities of companies located throughout the world.,透过主要（即以本基金资产净值最少四分之三）投资于位于全球各地的公司的股本及股本相关证券组合，达致长期资本增值。本基金将主要（即以其资产净值最少四分之三）投资于位于全球各地的公司的股本及股本相关证券组合，其中大部分须于合资格市场上市或买卖。股本相关证券包括普通及优先股票及股份、可转换优先股及认股权证。于认股权证的投资不得超过本基金资产净值的10%限额。本基金亦可透过美国预托证券及环球预托证券（统称为「预托证券」）等工具而间接投资于环球股本证券。,https://doc.morningstar.com/LatestDoc.aspx?clientid=magnumhk&key=4e7d32ed0acb6ed9&language=446&investmentid=F00000NB98&documenttype=52&market=1447&investmenttype=1,https://doc.morningstar.com/LatestDoc.aspx?clientid=magnumhk&key=4e7d32ed0acb6ed9&language=446&investmentid=F00000NB98&documenttype=76&market=1447&investmenttype=1,https://doc.morningstar.com/LatestDoc.aspx?clientid=magnumhk&key=4e7d32ed0acb6ed9&language=451&investmentid=F00000NB98&documenttype=4&market=1447&investmenttype=1,https://doc.morningstar.com/LatestDoc.aspx?clientid=magnumhk&key=4e7d32ed0acb6ed9&language=451&investmentid=F00000NB98&documenttype=5&market=1447&investmenttype=1,https://doc.morningstar.com/LatestDoc.aspx?clientid=magnumhk&key=4e7d32ed0acb6ed9&language=446&investmentid=F00000NB98&documenttype=1&market=1447&investmenttype=1,7,18,18,36,74,0.0161,2021/6/30,0.015,EUCA000556,2022/1/7
IE00B7JY6H00,FSGBR0579M,Barings International Umbrella Fund - Barings Hong Kong China Fund Class A USD Acc,霸菱国际伞子基金-香港中国基金 A USD Acc,USD,USD,0,1,11,1,-0.81,0.81,-0.2238,-0.2238,0.1955,0.2223,,1.3134,0.01261,4,1960841247,2012/3/14,5000,500,Baring International Fund Mgrs (Ireland) Limited,霸菱资产管理有限公司,"Objective: To provide long-term capital growth by investing in Hong Kong, China and Taiwan. Investment Policy: The Fund invests at least 70% of its total assets (excluding cash and cash-equivalent assets) in shares of companies incorporated in, exercising the predominant part of their economic activity in, or quoted or traded on stock exchanges in Hong Kong or China. The Fund is also permitted to invest to a lesser extent in shares of companies outside the Fund’s principal geographies (including but not limited to Taiwan), market sectors, currency or asset classes. The Fund may use derivative instruments for both investment and hedging purposes. The return on a derivative is linked to movements in an underlying instrument referenced by the derivative such as currency or interest rates. The base currency of the Fund is USD. Distribution Policy: N/A - Income will be rolled up into the value of your investment. Dealing Frequency: Daily. Investors can buy and sell their shares on demand on each Business Day (as defined in the prospectus). Benchmark: MSCI China 10/40 (Total Net Return) Index. The Fund is actively managed and is not designed to track the Benchmark so its performance may deviate materially from the Benchmark. The investment manager has complete discretion in making investments and is not constrained by the Benchmark. The Fund may invest significantly in instruments which are not included in the Benchmark. The Benchmark is used only for risk management and performance comparison purposes. The investment manager may consider, for example, issuer exposures, sector weights, country weights and tracking error in each case relative to the Benchmark but does not use the Benchmark as an investment limitation. For further details please refer to the prospectus and supplement.","The investment objective of the Fund is to achieve long-term capital grow th in the value of assets by investing in Hong Kong, China and Taiw an. The Fund w ill seek to achieve its investment objective by investing at least 70% of its total assets at any one time, either directly in equities or through equity-related securities (including depositary receipts) of companies (i) incorporated, or (ii) exercising the predominant part of their economic activity, or (iii) quoted or traded on the stock exchanges in markets in Hong Kong or China. A description of equity-related securities is described under the section headed “Investment Policy: General”. For this purpose, total assets exclude cash and ancillary liquidities.",该基金之目标为，藉由在香港、中国及台湾之投资而使其资产价值达到长期之资本成长。该基金将随时把至少70％的总资产投资在设立于香港或中国或在前开国家进行主要经济活动之公司的股权及股权相关证券，或在前开国家之证券交易所报价或交易的股票或股权相关证券等，借以达到其投资目标。股权相关证券之叙述请见「投资政策：通则」章节。就此一目的，总资产不包括现金及附属流动性资产。,https://doc.morningstar.com/LatestDoc.aspx?clientid=magnumhk&key=4e7d32ed0acb6ed9&language=451&investmentid=F00000NYNC&documenttype=52&market=1447&investmenttype=1,https://doc.morningstar.com/LatestDoc.aspx?clientid=magnumhk&key=4e7d32ed0acb6ed9&language=451&investmentid=F00000NYNC&documenttype=76&market=1447&investmenttype=1,https://doc.morningstar.com/LatestDoc.aspx?clientid=magnumhk&key=4e7d32ed0acb6ed9&language=451&investmentid=F00000NYNC&documenttype=4&market=1447&investmenttype=1,https://doc.morningstar.com/LatestDoc.aspx?clientid=magnumhk&key=4e7d32ed0acb6ed9&language=451&investmentid=F00000NYNC&documenttype=5&market=1447&investmenttype=1,https://doc.morningstar.com/LatestDoc.aspx?clientid=magnumhk&key=4e7d32ed0acb6ed9&language=451&investmentid=F00000NYNC&documenttype=1&market=1447&investmenttype=1,29,41,48,42,30,0.017,2021/10/31,0.0125,EUCA000504,2022/1/6
IE00BDCJY700,FS0000D7ZP,BNY Mellon Global Funds PLC - BNY Mellon U.S. Municipal Infrastructure Debt Fund USD A Acc,纽约梅隆美国市政基建债券投资基金 A Acc,USD,USD,0,1,21,2,0.16,,-0.0249,,0.0358,,,,,,1007082724,2020/2/21,5000,,BNY Mellon Fund Management (Lux) S.A.,纽约梅隆环球管理有限公司,"OBJECTIVE To provide as high a level of income as is consistent with the preservation of capital. POLICY The Fund will: invest predominantly in a portfolio of municipal bonds issued to finance infrastructure sectors and projects in the United States of America; invest in tender option bonds; invest in debt and debt related securities whichmay be investment grade quality or sub investment grade quality (lower than BBB- at the date of purchase as rated by Standard & Poor's or equivalent rating agencies); and invest in derivatives (financial instruments whose value is derived fromother assets) to help achieve the Fund's investment objective. The Fund will also use derivatives with the aim of risk or cost reduction or to generate additional capital or income. The Fund may: invest in government and/or corporate debt and debt-related securities; invest up to 10% of its net assets in securities rated below BB- at the date of purchase as rated by Standard & Poor's or equivalent rating agencies; invest up to 10% in other collective investment schemes; invest up to 10% of its net assets in aggregate in transferable securities or moneymarket instruments which are not admitted to or dealt in on an Eligible Market, in accordance with the UCITS Regulations; and invest a majority of its assets in cash, liquid or near cash assets in order to protect the value of the Fund. Recommendation: the Fund may not be appropriate for investors who plan to withdraw their money within five years. Treatment of income: net income from investments will be retained within the Fund and reflected in the value of your shares. Dealing: you can buy and sell your shares in the Fund between 9:00 and 17:00 (Irish time) on each business day in Ireland. Instructions received before 12:00 will receive the price quoted on that day. The minimum initial investment for this share class is USD 5,000.","The Sub-Fund seeks to provide as high a level of income as is consistent with the preservation of capital. In order to achieve its investment objective of providing a high level of income with the aim of preserving capital at the same time, the Sub-Fund invests predominantly (meaning at least 75% of the Net Asset Value of the SubFund) in a portfolio of municipal bonds which are listed or traded on Eligible Markets. Municipal bonds are bonds issued by a state, municipality, not-for-profit corporate issuers or special purpose district such as transit authorities (i.e. independent, special-purpose governmental units that exist separately from local governments) in the United States of America to finance infrastructure sectors and projects conducted within the United States of America, its territories and possessions.",,https://doc.morningstar.com/LatestDoc.aspx?clientid=magnumhk&key=4e7d32ed0acb6ed9&language=451&investmentid=F000014VD3&documenttype=52&market=1447&investmenttype=1,https://doc.morningstar.com/LatestDoc.aspx?clientid=magnumhk&key=4e7d32ed0acb6ed9&language=451&investmentid=F000014VD3&documenttype=76&market=1447&investmenttype=1,https://doc.morningstar.com/LatestDoc.aspx?clientid=magnumhk&key=4e7d32ed0acb6ed9&language=451&investmentid=F000014VD3&documenttype=4&market=1447&investmenttype=1,https://doc.morningstar.com/LatestDoc.aspx?clientid=magnumhk&key=4e7d32ed0acb6ed9&language=451&investmentid=F000014VD3&documenttype=5&market=1447&investmenttype=1,https://doc.morningstar.com/LatestDoc.aspx?clientid=magnumhk&key=4e7d32ed0acb6ed9&language=451&investmentid=F000014VD3&documenttype=1&market=1447&investmenttype=1,75,32,68,2,,0.0113,2021/6/30,0.01,EUCA000582,2022/1/7
IE00BF47CT44,FS0000DCO0,Jupiter Financials Contingent Capital Fund L USD Acc,,USD,USD,0,1,30,2,1.51,0.78,-0.0216,-0.1906,0.0276,0.1306,,,,,175078270.7,2017/8/14,1000,500,Jupiter Asset Management (Europe) Limited,,"Objective: a total return comprised of income and long-term capital growth Policy: the Fund will invest in a diversified range of bonds and similar debt investments with fixed and variable interest rates issued by companies throughout the world. Typically at least 75% of the invested assets will be held in contingent convertible bonds (“CoCos”) issued by banks, finance and insurance companies. A CoCo is a type of bond which, upon a pre-specified trigger event, may convert into either a set number of Company shares, or may be subject to a partial or full write-off. Examples of trigger events include pre-defined capital ratios of the issuer falling to a particular level, or the issue/issuer being subject to a regulatory action or decision by the responsible regulator in the issuer's home market. The Fund may invest up to 100% in sub-investment grade bonds and similar debt investments (e.g. those with a rating of below BBB- as rated by Standard and Poor’s or below Baa3 by Moody’s). For those investments not denominated in US Dollars, the Fund may use techniques to try to reduce the effects of changes in the exchange rate between US Dollars and other currencies (i.e. hedging). This aims to protect the Fund against losses caused by currency movements between the Fund base currency, US Dollars, and the currency of the non US Dollar denominated assets of the Fund. The Fund is managed having regard to the Bloomberg Barclays Contingent Capital Western Europe Index, however the Fund does not track the Index. The Fund will also use derivatives (i.e. financial contracts whose value is linked to the expected price movements of an underlying investment), with the aim of generating returns and/or reducing the overall costs and risks of the Fund. Recommendation: the Fund may not be appropriate for investors who plan to withdraw their money within 5 years. Treatment of income: As shares in this class are accumulation shares, income from investments will be reinvested into the Fund and reflected in the value of the shares. Dealing: you can buy and sell shares on business days where retail banks are open for business in Dublin and London (excluding Saturdays, Sundays and public holidays).",The fund aims to generate a total return,,https://doc.morningstar.com/LatestDoc.aspx?clientid=magnumhk&key=4e7d32ed0acb6ed9&language=451&investmentid=F00000Z71X&documenttype=52&market=1447&investmenttype=1,N/A,https://doc.morningstar.com/LatestDoc.aspx?clientid=magnumhk&key=4e7d32ed0acb6ed9&language=451&investmentid=F00000Z71X&documenttype=4&market=1447&investmenttype=1,https://doc.morningstar.com/LatestDoc.aspx?clientid=magnumhk&key=4e7d32ed0acb6ed9&language=451&investmentid=F00000Z71X&documenttype=5&market=1447&investmenttype=1,https://doc.morningstar.com/LatestDoc.aspx?clientid=magnumhk&key=4e7d32ed0acb6ed9&language=451&investmentid=F00000Z71X&documenttype=1&market=1447&investmenttype=1,,,,,,0.0177,2021/6/30,0.015,EUCA000771,2022/1/6
IE00BFM0L103,FSUSA0BEFZ,Barings Global Senior Secured Bond Fund G USD Accumulating Shares,霸菱环球高级抵押债券基金 G USD Acc,USD,USD,0,1,90,2,2.4,0.74,-0.0112,-0.1298,0.0214,0.0821,,,,3,1724487882,2018/10/1,1000,,Baring International Fund Mgrs (Ireland) Limited,,"Objective: To provide high current income generation and, where appropriate, capital appreciation. Investment Policy: The Fund invests principally in a portfolio of corporate debt instruments worldwide, focusing on North American and European senior secured high yield instruments. Corporate debt instruments include bonds and notes. A high yield (sub-investment grade) debt instrument/security is one which carries a higher rate of interest, usually because the investors are accepting a higher degree of risk. However, senior secured debt instruments legally repay ahead of subordinated (non-senior) debt, 'secured' against collateral pledged by the debt issuer and typically carry a lower risk of loss than other debt instruments issued by the same corporation. The Fund is also permitted to invest to a lesser extent in other types of debt instruments such as unsecured high yield bonds, investment grade bonds, other Funds, cash and cash-equivalent securities and money market instruments. The Fund may use derivative instruments for both investment and hedging purposes. The return on a derivative is linked to movements in an underlying instrument referenced by the derivative such as currency or interest rates. The base currency of the Fund is USD. Distribution Policy: N/A - Income will be rolled up into the value of your investment. Dealing Frequency: Daily. Investors can buy and sell their shares on demand on each Business Day (as defined in the prospectus). Benchmark: ICE BoAML BB-B Global High Yield Secured Bond Index'. The Fund is actively managed and is not designed to track the Benchmark so its performance may deviate materially from the Benchmark. The investment manager has complete discretion in making investments and is not constrained by the Benchmark. The Fund may invest significantly in instruments which are not included in the Benchmark. The Benchmark is used only for risk management and performance comparison purposes. The investment manager may consider, for example, issuer exposures, duration, sector weights, country weights, credit ratings and tracking error in each case relative to the Benchmark but does not use the Benchmark as an investment limitation. For further details please refer to the prospectus and supplement.","The investment objective of the Fund is to provide high current income generation and, where appropriate, capital appreciation.",霸菱环球高级抵押债券基金（「本基金」）是主动型管理的高级抵押债券策略，旨在向投资者提供高流动收益及（如适用）资本增值。,https://doc.morningstar.com/LatestDoc.aspx?clientid=magnumhk&key=4e7d32ed0acb6ed9&language=446&investmentid=F000011A85&documenttype=52&market=1447&investmenttype=1,https://doc.morningstar.com/LatestDoc.aspx?clientid=magnumhk&key=4e7d32ed0acb6ed9&language=451&investmentid=F000011A85&documenttype=76&market=1447&investmenttype=1,https://doc.morningstar.com/LatestDoc.aspx?clientid=magnumhk&key=4e7d32ed0acb6ed9&language=451&investmentid=F000011A85&documenttype=4&market=1447&investmenttype=1,https://doc.morningstar.com/LatestDoc.aspx?clientid=magnumhk&key=4e7d32ed0acb6ed9&language=451&investmentid=F000011A85&documenttype=5&market=1447&investmenttype=1,https://doc.morningstar.com/LatestDoc.aspx?clientid=magnumhk&key=4e7d32ed0acb6ed9&language=451&investmentid=F000011A85&documenttype=1&market=1447&investmenttype=1,50,22,17,12,49,0.0132,2021/6/30,0.0125,EUCA000766,2022/1/6
