fundISINCode,parentCode,fundNameEN,fundNameSC,baseCurrency,shareClassCurrency,fundIndustry,fundStatus,fundRegion,fundInvestType,sharpeRatioM12,sharpeRatioM36,maxDrawdownM12,maxDrawdownM36,standardDeviationM12,standardDeviationM36,dividendFrequencyType,dividendYield,latestDividendYield,msRating,fundAssetsSize,fundSetupDate,minInitialInvestment,minSubsequentInvestment,fundManagementCompanyEN,fundManagementCompanySC,fundInvestObject,fundInvestStrategyEN,fundInvestStrategySC,fundFactSheet,fundStatement,fundAnnualReport,fundInterimReport,fundProspectus,peerGroupRankM1,peerGroupRankM3,peerGroupRankM6,peerGroupRankM12,peerGroupRankM36,netExpenseRatio,annualReportDate,managementFee,categoryId,reportDate
IE0000829568,FSGBR0579P,Barings Global Bond Fund-Class A USD Inc,霸菱国际伞子基金-国际债券基金USD,USD,USD,0,1,0,2,-1.96,0.35,-0.0983,-0.0983,0.0521,0.0649,a$,,,4,68023253.63,1978/7/7,5000,500,Baring International Fund Mgrs (Ireland) Limited,霸菱资产管理有限公司,"Objective: To seek a maximum total return, through current income generation and capital appreciation. Investment Policy: The fund invests primarily in an actively managed globally diversified portfolio which at least 80% of its Net Asset Value is invested in fixed income instruments. - The fixed income instruments in which the Fund invests may include government bonds, covered bonds, global corporate bonds, notes, debentures, government obligations and sovereign issues, commercial paper, asset-backed securities (“ABS”), commercial and residential- mortgage backed securities (“CMBS” and “RMBS”). The Fund may invest in investment grade and up to 50% of the Fund’s Net Asset Value in sub- investment grade fixed income instruments; up to 25% of its Net Asset Value in collateralised and/or securitised products such as covered bonds, ABS, CMBS and RMBS; and up to 10% of its Net Asset Value in securities issued and/or guaranteed by a single sovereign (including its government, a public or local government of that country) which is rated sub-investment grade. An investment grade fixed income security is one which carries a lower (but not zero) degree of risk than sub-investment grade fixed income securities, as such investment grade fixed income securities typically carry a lower rate of interest than higher yielding fixed income securities. - The fund may use derivative instruments for both investment and hedging purposes. The return on a derivative is linked to movements in an underlying instrument referenced by the derivative such as currency or interest rates. The base currency of the fund is USD. Distribution Policy: Income will be declared and distributed as a dividend semi-annually. Dealing Frequency: Daily. Investors can buy and sell their shares on demand on each Business Day (as defined in the prospectus and supplement). Benchmark: FTSE World Government Bond Index'. The fund is actively managed and is not designed to track the Benchmark so its performance may deviate materially from the Benchmark. The investment manager will manage global exposure of the fund to within 200% of the Benchmark's value-at-risk (""VaR”). The VaR of a fund is a daily estimation of the maximum loss which a fund may incur over a 1 day period. The investment manager has complete discretion in making investments and is not otherwise constrained by the Benchmark. The fund may invest significantly in instruments which are not included in the Benchmark. As well as this, the Benchmark is used only for risk management and performance comparison purposes. The investment manager may consider, for example, issuer exposures, duration, sector weights, country weights, credit ratings and tracking error in each case relative to the Benchmark but (other than as set out above) does not use the Benchmark as an investment limitation. For further details please refer to the prospectus and supplement.","The investment objective of the Fund is to seek a maximum total return, through current income generation and capital appreciation. The “total return” sought by the Fund consists of income and capital appreciation, if any, w hich generally arises from decreases in interest rates or improving credit fundamentals for a particular government, industry sector or security.",本基金的目标是达至具吸引力的收益水平，同时有可能达至资产值的长期增值。按经理人的政策，本基金将持有一个国际性的多元化公司及政府定息C券投资组合。,https://doc.morningstar.com/LatestDoc.aspx?clientid=magnumhk&key=4e7d32ed0acb6ed9&language=451&investmentid=F0GBR04SJ5&documenttype=52&market=1447&investmenttype=1,https://doc.morningstar.com/LatestDoc.aspx?clientid=magnumhk&key=4e7d32ed0acb6ed9&language=451&investmentid=F0GBR04SJ5&documenttype=76&market=1447&investmenttype=1,https://doc.morningstar.com/LatestDoc.aspx?clientid=magnumhk&key=4e7d32ed0acb6ed9&language=451&investmentid=F0GBR04SJ5&documenttype=4&market=1447&investmenttype=1,https://doc.morningstar.com/LatestDoc.aspx?clientid=magnumhk&key=4e7d32ed0acb6ed9&language=451&investmentid=F0GBR04SJ5&documenttype=5&market=1447&investmenttype=1,https://doc.morningstar.com/LatestDoc.aspx?clientid=magnumhk&key=4e7d32ed0acb6ed9&language=451&investmentid=F0GBR04SJ5&documenttype=1&market=1447&investmenttype=1,99,81,80,98,46,0.012,2021/4/30,0.0075,EUCA000759,2022/1/6
IE0000830129,FSGBR0579N,Barings International Umbrella Fund - Barings Asia Growth Fund ClassA USD Inc,霸菱国际伞子基金-亚洲增长基金 - USD,USD,USD,0,1,10,1,-0.07,1.03,-0.1019,-0.1792,0.1272,0.2018,A$,2.05578,0.01528,5,236025249.7,1987/2/3,5000,500,Baring International Fund Mgrs (Ireland) Limited,霸菱资产管理有限公司,"Objective: To provide long-term capital growth by investing in Asia and the Pacific region excluding Japan. Investment Policy: The Fund invests at least 70% of its total assets (excluding cash and cash equivalent assets) in the shares of companies incorporated in, exercising the predominant part of their economic activity in, or quoted or traded on stock exchanges in Asia and the Pacific region (excluding Japan). The Fund is also permitted to invest to a lesser extent in shares of companies outside the Asia Pacific region (excluding Japan) as well as in fixed income securities and cash. The Fund may use derivative instruments for both investment and hedging purposes. The return on a derivative is linked to movements in an underlying instrument referenced by the derivative such as currency or interest rates. The base currency of the Fund is USD. Distribution Policy: Income will be declared and distributed as a dividend annually. Dealing Frequency: Daily. Investors can buy and sell their shares on demand on each Business Day (as defined in the prospectus). Benchmark: MSCI All Country Asia ex-Japan (Total Net Return) Index'. The Fund is actively managed and is not designed to track the Benchmark so its performance may deviate materially from the Benchmark. The investment manager has complete discretion in making investments and is not constrained by the Benchmark. The Fund may invest significantly in instruments which are not included in the Benchmark. The Benchmark is used only for risk management and performance comparison purposes. The investment manager may consider, for example, issuer exposures, sector weights, country weights and tracking error in each case relative to the Benchmark but does not use the Benchmark as an investment limitation. For further details please refer to the prospectus and supplement.","The investment objective of the Fund is to achieve long-term capital grow th in the value of assets by investing in Asia and the Pacific region excluding Japan. The Fund w ill seek to achieve its investment objective by investing at least 70% of its total assets in equities and equityrelated securities of companies incorporated in, or exercising the predominant part of their economic activity in the Asia Pacific region excluding Japan, or quoted or traded on the stock exchanges in those countries, including developed and emerging markets. For this purpose, total assets exclude cash and ancillary liquidities. For the remainder of its total assets, the Fund may invest outside the Asia Pacific region (excluding Japan) as w ell as in fixed income and cash.",本基金的目标是投资於一个多元化的亚洲股票投资组合，以达至资产值的长期资本增长。,https://doc.morningstar.com/LatestDoc.aspx?clientid=magnumhk&key=4e7d32ed0acb6ed9&language=451&investmentid=F0GBR04SJ1&documenttype=52&market=1447&investmenttype=1,https://doc.morningstar.com/LatestDoc.aspx?clientid=magnumhk&key=4e7d32ed0acb6ed9&language=451&investmentid=F0GBR04SJ1&documenttype=76&market=1447&investmenttype=1,https://doc.morningstar.com/LatestDoc.aspx?clientid=magnumhk&key=4e7d32ed0acb6ed9&language=451&investmentid=F0GBR04SJ1&documenttype=4&market=1447&investmenttype=1,https://doc.morningstar.com/LatestDoc.aspx?clientid=magnumhk&key=4e7d32ed0acb6ed9&language=451&investmentid=F0GBR04SJ1&documenttype=5&market=1447&investmenttype=1,https://doc.morningstar.com/LatestDoc.aspx?clientid=magnumhk&key=4e7d32ed0acb6ed9&language=451&investmentid=F0GBR04SJ1&documenttype=1&market=1447&investmenttype=1,76,87,48,29,6,,2021/4/30,0.0125,EUCA000779,2022/1/6
IE0008368742,FSGBR0504S,FSSA China Growth Fund Class I (Accumulation) USD,首源环球伞子基金-首源中国增长基金 I,USD,USD,0,1,11,1,-0.4,0.92,-0.1287,-0.1655,0.1354,0.1863,,2.03295,0.01745,4,3898110268,1999/8/17,1000,500,First Sentier Investors (Hong Kong) Limited,首源投资（香港）有限公司,"Objective: The Fund aims to grow your investment. Policy: The Fund invests at least 70% of its assets in shares of companies based in, or closely associated with, mainland China. The Fund may invest up to 100% of its assets in any industry and in companies of any size. The Fund will invest less than 100% of its assets in China A Shares. The Fund is actively managed meaning that the manager uses expertise to pick investments rather than tracking a benchmark. The Fund’s performance is compared against the value of the MSCI China Index. A majority of the Fund’s assets can be expected to be components of the benchmark. Investment of the Fund’s assets is not constrained by the benchmark composition and the Manager has discretion within the Fund’s investment policy to invest in assets without regard to the benchmark. The Fund may use derivatives with the aim of risk reduction or efficient management. You can buy and sell shares in the Fund on any day on which Irish banks are open for business. As long as we receive your instruction before 10 am (Irish time), shares will be bought at that day’s price. The Fund's manager may use its discretion when deciding which investments should be held by the Fund. You will not receive any income from your investment. Any income will be rolled up into the value of shares in the Fund. Recommendation: this Fund may not be appropriate for investors who plan to withdraw their money within five years.","The Fund invests primarily (at least 70% of its Net Asset Value) in equity securities or equity-related securities issued by companies with either assets in, or revenues derived from the People’s Republic of China that are listed, traded or dealt in on Regulated Markets in China, Hong Kong, Taiwan, the U.S. or in a member state of the OECD. The Fund is not subject to any limitation on the portion of its Net Asset Value that may be invested in any sector or any limitation on the market capitalisation of the companies in which it may invest.",该基金主要投资於在中华人民共和国、香港、台湾、美国或经合发组织成员国受监管市场上市、买卖或交易的证券，发行该等证券的企业必须在中国拥有资a，又或其收入乃来自中国。,https://doc.morningstar.com/LatestDoc.aspx?clientid=magnumhk&key=4e7d32ed0acb6ed9&language=446&investmentid=F0GBR04C5N&documenttype=52&market=1447&investmenttype=1,https://doc.morningstar.com/LatestDoc.aspx?clientid=magnumhk&key=4e7d32ed0acb6ed9&language=451&investmentid=F0GBR04C5N&documenttype=76&market=1447&investmenttype=1,https://doc.morningstar.com/LatestDoc.aspx?clientid=magnumhk&key=4e7d32ed0acb6ed9&language=451&investmentid=F0GBR04C5N&documenttype=4&market=1447&investmenttype=1,https://doc.morningstar.com/LatestDoc.aspx?clientid=magnumhk&key=4e7d32ed0acb6ed9&language=451&investmentid=F0GBR04C5N&documenttype=5&market=1447&investmenttype=1,https://doc.morningstar.com/LatestDoc.aspx?clientid=magnumhk&key=4e7d32ed0acb6ed9&language=446&investmentid=F0GBR04C5N&documenttype=1&market=1447&investmenttype=1,8,8,12,13,30,0.0211,2021/6/30,0.02,EUCA000504,2022/1/6
IE0008369823,FSUSA081XF,FSSA Hong Kong Growth Fund Class I (Accumulation) USD,首源环球伞子基金-首源香港增长基金 I,USD,USD,0,1,10,1,-0.37,0.47,-0.1483,-0.1772,0.1271,0.168,,2.56211,0.025,4,167120520.5,2000/2/22,1000,500,First Sentier Investors (Hong Kong) Limited,首源投资（香港）有限公司,"Objective: The Fund aims to grow your investment. Policy: The Fund invests at least 70% of its assets in shares of companies which have the potential for long term growth and are based in, or are closely associated with, Hong Kong. The Fund may invest up to 100% of its assets in companies of any size or industry. The Fund will not invest more than 30% of its assets in China A Shares. The Fund is actively managed meaning that the manager uses expertise to pick investments rather than tracking a benchmark. The Fund’s performance is compared against the value of the MSCI Hong Kong Index. A majority of the Fund’s assets can be expected to be components of the benchmark. Investment of the Fund’s assets is not constrained by the benchmark composition and the Manager has discretion within the Fund’s investment policy to invest in assets without regard to the benchmark. The Fund may use derivatives with the aim of risk reduction or efficient management. You can buy and sell shares in the Fund on any day on which Irish banks are open for business. As long as we receive your instruction before 10 am (Irish time), shares will be bought at that day’s price. The Fund's manager may use its discretion when deciding which investments should be held by the Fund. You will not receive any income from your investment. Any income will be rolled up into the value of shares in the Fund. Recommendation: this Fund may not be appropriate for investors who plan to withdraw their money within five years.","The Fund invests primarily (at least 70% of its Net Asset Value) in equity securities or equity-related securities listed on the Stock Exchange of Hong Kong Limited or securities issued by such companies which in the Investment Manager’s opinion have significant assets, business, production activities, trading or other business interests in Hong Kong and traded on Regulated Markets. The Fund is not subject to any limitation on the portion of its Net Asset Value that may be invested in any sector or any limitation on the market capitalisation of the companies in which it may invest.",该基金主要投资於在香港联合交易所有限公司上市又或投资经理认樵谙愀塾涤兄卮笞十a、业务、生a活动、贸易或其他业务权益并在受监管市场买卖的证券。本基金於2001年12月1日之前原名CMG首源香港增长基金。旧有的巴克莱亚洲精选-香港基金於2002年4月25日与此基金Class I 合恪,https://doc.morningstar.com/LatestDoc.aspx?clientid=magnumhk&key=4e7d32ed0acb6ed9&language=446&investmentid=F0000007ZG&documenttype=52&market=1447&investmenttype=1,https://doc.morningstar.com/LatestDoc.aspx?clientid=magnumhk&key=4e7d32ed0acb6ed9&language=451&investmentid=F0000007ZG&documenttype=76&market=1447&investmenttype=1,https://doc.morningstar.com/LatestDoc.aspx?clientid=magnumhk&key=4e7d32ed0acb6ed9&language=451&investmentid=F0000007ZG&documenttype=4&market=1447&investmenttype=1,https://doc.morningstar.com/LatestDoc.aspx?clientid=magnumhk&key=4e7d32ed0acb6ed9&language=451&investmentid=F0000007ZG&documenttype=5&market=1447&investmenttype=1,https://doc.morningstar.com/LatestDoc.aspx?clientid=magnumhk&key=4e7d32ed0acb6ed9&language=446&investmentid=F0000007ZG&documenttype=1&market=1447&investmenttype=1,35,14,20,22,13,,2021/6/30,0.015,EUCA000519,2022/1/6
IE00B0MD9M11,FSGBR04QC2,PIMCO GIS Global Bond Fund E Class USD Income,PIMCO 环球债券基金 E INC,USD,USD,0,1,90,2,-1.03,0.92,-0.025,-0.028,0.0228,0.0332,Q$,0,0,3,14037251647,2005/10/28,1000,,PIMCO Global Advisors (Ireland) Limited,,"The fund aims to prudently generate a total return through a combination of both income and capital growth. The fund invests primarily in a range of ""investment grade"" fixed income securities (which are loans that pay a fixed or variable rate of interest) issued by companies or governments from around the world. Securities will be priced in a range of global currencies. The investment advisor will choose securities with varying repayment dates based on its expectations for interest rate and exchange rate changes. The fund may invest substantially in emerging markets, which in investment terms are those economies that are still developing. Investment grade securities, as determined by international ratings agencies, whilst potentially producing a lower level of income than ""noninvestment grade"" securities, are also considered to be of lower risk. The fund may also invest up to 10% in securities which are rated lower than ""BBB"" but rated at least ""B"" by these same agencies. These are generally considered to be riskier investments but pay a higher income. The fund's benchmark is the Barclays Capital Global Aggregate Index (USD ). It is used to measure duration. Duration is the sensitivity of a fixed income security to a change in interest rates. The longer the duration of a fixed income security, the higher its sensitivity to interest rates. For full investment objectives and policy details please refer to the prospectus. The fund may invest in derivative instruments (such as futures, options and swaps) rather than directly in the underlying securities themselves. The derivatives return is linked to movements in the underlying asset. Any income the fund generates will be paid out to your bank account or automatically reinvested in shares depending upon your election. You can buy and sell shares on most working days in Dublin, exceptions to this are more fully described in the Fund Holiday Calendar available from the Administrator.","The investment objective of the Fund is to seek to maximise total return, consistent with preservation of capital and prudent investment management. The Fund invests at least two-thirds of its assets in a diversified portfolio of Fixed Income Instruments denominated in major world currencies. The average portfolio duration of this Fund will normally vary within three years (plus or minus) of the Bloomberg Barclays Global Aggregate Index (the “Index”). The Index provides a broad-based measure of the global investment-grade fixed income markets. The three major components of this Index are the U.S. Aggregate, the Pan-European Aggregate, and the AsianPacific Aggregate Indices. The Index also includes Eurodollar and EuroYen corporate bonds, Canadian Government securities, and USD investment grade 144A securities. Details of the duration of the Index will be available from the Investment Advisor upon request.",本基金的目标是在保存资本及审慎投资管理的原则下，赚取最高总回报（即透过深入研究及慎重考虑，确立及施行一些贯彻一致、规律严格并具成本效益的投资的策略，以及持续监察个别证券与总投资组合的风险）。本基金将其最少三分之二的资产投资于一项以全球各种主要货币计价的固定收益工具（可包括由政府、主权机构、企业 等发行的证券）组成的多元化投资组合。本基金主要投资于投资级别固定收益工具，惟可将其资产最多达10%投资于评级低于穆迪的Baa 或标准普尔的BBB 评级或获惠誉给予的同等评级，但最少须获穆迪或标准普尔给予B 评级或获惠誉给予同等评级（或若未有评级，则须获投资顾问视为具备相若质素）的固定收益工具，但并无最低信贷评级规定的按揭保证证券例外。虽然对按揭证券并无最低信贷评级规定，但在计算低于投资级别证券的上述 10%限额时将计及低于投资 级别的按揭证券。,https://doc.morningstar.com/LatestDoc.aspx?clientid=magnumhk&key=4e7d32ed0acb6ed9&language=446&investmentid=F0GBR067Y1&documenttype=52&market=1447&investmenttype=1,https://doc.morningstar.com/LatestDoc.aspx?clientid=magnumhk&key=4e7d32ed0acb6ed9&language=451&investmentid=F0GBR067Y1&documenttype=76&market=1447&investmenttype=1,https://doc.morningstar.com/LatestDoc.aspx?clientid=magnumhk&key=4e7d32ed0acb6ed9&language=451&investmentid=F0GBR067Y1&documenttype=4&market=1447&investmenttype=1,https://doc.morningstar.com/LatestDoc.aspx?clientid=magnumhk&key=4e7d32ed0acb6ed9&language=451&investmentid=F0GBR067Y1&documenttype=5&market=1447&investmenttype=1,https://doc.morningstar.com/LatestDoc.aspx?clientid=magnumhk&key=4e7d32ed0acb6ed9&language=451&investmentid=F0GBR067Y1&documenttype=1&market=1447&investmenttype=1,39,62,70,72,41,0.0139,2021/6/30,0.0139,EUCA000759,2022/1/6
