IE00B193ML14,FSGBR072BR,PIMCO GIS Global High Yield Bond Fund E Class USD Income,PIMCO环球高孳息债券 E INC,USD,USD,0,1,90,2,0.98,0.74,-0.0178,-0.1162,0.0264,0.0817,Q$,,,3,5169310433,2006/7/31,1000,,PIMCO Global Advisors (Ireland) Limited,,"The fund aims to prudently generate a total return through a combination of both income and capital growth. The fund invests primarily in a range of ""high yield"" fixed income securities (which are loans that pay a fixed or variable rate of interest) issued by companies from around the world. These will mainly be priced in US Dollars but the fund may also hold other currencies as well as securities that are priced in other currencies. Investments may also be linked to emerging market countries, which in investment terms are those economies that are still developing. These high yield investments have a rating lower than ""Baa"" from Moody's or ""BBB"" from S&P, reflecting the higher risk of an institution defaulting on its payments. The fund may also invest up to 20% in lower rated securities of ""Caa"" and ""CCC"" by these same agencies. These are generally considered to be riskier investments but pay a higher income. The fund's benchmark is the BofA Merrill Lynch Global High Yield BB B Rated Constrained Index (USD ). It is used to measure duration. Duration is the sensitivity of a fixed income security to a change in interest rates. The longer the duration of a fixed income security, the higher its sensitivity to interest rates. For full investment objectives and policy details please refer to the prospectus. The fund may invest in derivative instruments (such as futures, options and swaps) rather than directly in the underlying securities themselves. The derivatives return is linked to movements in the underlying asset. Any income the fund generates will be paid out to your bank account or automatically reinvested in shares depending upon your election. You can buy and sell shares on most working days in Dublin, exceptions to this are more fully described in the Fund Holiday Calendar available from the Administrator.","The investment objective of the Fund is to seek to maximise total return, consistent with prudent investment management. The Fund invests at least two-thirds of its total net assets in a diversified portfolio of high yield Fixed Income Instruments that are denominated in major world currencies and are rated lower than Baa by Moody’s or BBB by S&P or equivalently rated by Fitch. The Fund may invest up to 20% of its total net assets in high yield Fixed Income Instruments that are rated Caa or lower by Moody’s or CCC or lower by S&P or equivalently rated by Fitch (or, if unrated, determined by the Investment Advisor to be of a comparable quality). The portion of the Fund’s assets that are not invested in Fixed Income Instruments rated lower than Baa by Moody’s or lower than BBB by S&P or equivalently rated by Fitch may be invested in higher quality Fixed Income Instruments.",本基金的投资目标是以维护资本及审慎的投资管理寻求最大总回报。本基金叁分之二以上的资产投资於以世界主要货币计价且Moody’s 评为Baa 以下或S&P 评为BBB 以下(或若未经评等，则由投资顾问判断其相对品质)之高报酬固定收益C券的各种组合。本基金可将其全部资产投资於高报酬C券，但Moody’s 或S&P 评为B 以下(或若未经评等，则由投资顾问判断其相对品质)之C券不得超过其资产的5%。本基金其馀资产可投资於较高品质的固定收益C券。本基金之平均投资组合存续期间将根据投资顾问对於利率的预测而异，通常介於二至七年。本基金90%以上的资产将投资於OECD 受规管市场上市、交易或处理之C券。,https://doc.morningstar.com/LatestDoc.aspx?clientid=magnumhk&key=4e7d32ed0acb6ed9&language=446&investmentid=FOGBR05KHW&documenttype=52&market=1447&investmenttype=1,https://doc.morningstar.com/LatestDoc.aspx?clientid=magnumhk&key=4e7d32ed0acb6ed9&language=451&investmentid=FOGBR05KHW&documenttype=76&market=1447&investmenttype=1,https://doc.morningstar.com/LatestDoc.aspx?clientid=magnumhk&key=4e7d32ed0acb6ed9&language=451&investmentid=FOGBR05KHW&documenttype=4&market=1447&investmenttype=1,https://doc.morningstar.com/LatestDoc.aspx?clientid=magnumhk&key=4e7d32ed0acb6ed9&language=451&investmentid=FOGBR05KHW&documenttype=5&market=1447&investmenttype=1,https://doc.morningstar.com/LatestDoc.aspx?clientid=magnumhk&key=4e7d32ed0acb6ed9&language=451&investmentid=FOGBR05KHW&documenttype=1&market=1447&investmenttype=1,24,34,33,53,49,0.0145,2021/6/30,0.0145,EUCA000766,2022/1/6
IE00B193MN38,FSGBR04JBI,PIMCO GIS US High Yield Bond Fund E Class USD Income,PIMCO高孳息债券基金 E-INC,USD,USD,0,1,21,2,1.24,0.75,-0.0166,-0.1225,0.0274,0.0864,Q$,,,3,3923909032,2006/7/31,1000,,PIMCO Global Advisors (Ireland) Limited,,"Objective The fund aims to maximise the total return on your investment through primarily investing in a range of “high yield” fixed income securities and instruments, using prudent investment management principles. Investment Policy The fund aims to achieve this objective by investing primarily in a range of “high yield” fixed income securities and instruments (which are loans that pay a fixed or variable rate of interest) issued by companies from around the world. These “high yield” investments will be “non-investment grade”. Non-investment grade securities are considered to be more risky, but typically produce a higher level of income. The average portfolio duration of this fund will normally vary within two years (plus or minus) of the BofA Merrill Lynch US High Yield Constrained Index. Duration measures the sensitivity of the assets to interest rate risk. The longer the duration the higher the sensitivity to changes in interest rates. The fund may invest in emerging markets, which in investment terms are those economies that are not as developed. The fund may invest in derivative instruments (such as futures, options and swaps) rather than directly in the underlying securities themselves. The derivatives return is linked to movements in the underlying assets. The assets held by the fund may be denominated in a wide variety of currencies with non-USD currency exposure limited to 20% of total assets. The investment advisor may use foreign exchange and related derivative instruments to hedge or implement currency positions. For full investment objectives and policy details please refer to the fund’s prospectus. Distribution Policy This share class pays out a distribution of any investment income generated by the fund. You may elect for this to be reinvested into the fund. Dealing Day You can buy and sell shares on most working days in Dublin, exceptions to this are more fully described in the fund holiday calendar available from the Administrator.","The investment objective of the US High Yield Bond Fund is to seek to maximise total return, consistent with preservation of capital and prudent investment management. The Fund invests at least two-thirds of its total net assets in a diversified portfolio of high yield Fixed Income Instruments that are rated lower than Baa by Moody’s or lower than BBB by S&P or equivalently rated by Fitch. In normal market conditions the Fund may invest up to 30% of its total net assets in high yield Fixed Income Instruments that are rated Caa or lower by Moody’s or CCC or lower by S&P or equivalently rated by Fitch (or, if unrated, determined by the Investment Advisor to be of comparable quality).",本基金在符合资本保值及审慎投资管理的原则下寻求达至最高的总回报率。,https://doc.morningstar.com/LatestDoc.aspx?clientid=magnumhk&key=4e7d32ed0acb6ed9&language=446&investmentid=FOGBR05KI5&documenttype=52&market=1447&investmenttype=1,https://doc.morningstar.com/LatestDoc.aspx?clientid=magnumhk&key=4e7d32ed0acb6ed9&language=451&investmentid=FOGBR05KI5&documenttype=76&market=1447&investmenttype=1,https://doc.morningstar.com/LatestDoc.aspx?clientid=magnumhk&key=4e7d32ed0acb6ed9&language=451&investmentid=FOGBR05KI5&documenttype=4&market=1447&investmenttype=1,https://doc.morningstar.com/LatestDoc.aspx?clientid=magnumhk&key=4e7d32ed0acb6ed9&language=451&investmentid=FOGBR05KI5&documenttype=5&market=1447&investmenttype=1,https://doc.morningstar.com/LatestDoc.aspx?clientid=magnumhk&key=4e7d32ed0acb6ed9&language=451&investmentid=FOGBR05KI5&documenttype=1&market=1447&investmenttype=1,38,75,75,70,54,0.0145,2021/6/30,0.0145,EUCA000583,2022/1/6
IE00B1D7YK27,FSUSA09TVQ,PIMCO GIS Diversified Income Fund E Class USD Accumulation,PIMCO多元化入息基金 - E ACC,USD,USD,0,1,90,2,-0.31,0.76,-0.0289,-0.0931,0.0327,0.0721,,,0,4,16435366039,2006/9/11,1000,,PIMCO Global Advisors (Ireland) Limited,,"Objective The fund aims to maximise the total return on your investment through providing efficient access to broad global credit market exposure by investing primarily in a diversified portfolio of fixed income securities and instruments of varying maturities, using prudent investment management principles. Investment Policy The fund is an actively managed portfolio which seeks to achieve its investment objective by investing primarily in a diversified pool of corporate and emerging market fixed income securities and instruments (which are loans that pay a fixed or variable rate of interest) issued by companies or governments from around the world. The fund’s average portfolio duration will normally be within positive or negative two years of that of the fund’s benchmark (an equally weighted blend of the Bloomberg Barclays Global Aggregate Credit ex-Emerging Markets, the ICE BofAML BB-B Rated Developed Markets High Yield Constrained and the JPMorgan EMBI Global, indices (all USD hedged)). Duration measures the sensitivity of the assets to interest rate risk. The longer the duration the higher the sensitivity to changes in interest rates. The securities will be both “investment grade” and “non-investment grade. Non-investment grade securities are considered to be more risky, but typically produce a higher level of income. The fund may invest substantially in emerging markets, which in investment terms are those economies that are still developing. The fund may invest in derivative instruments (such as futures, options and swaps) rather than directly in the underlying securities themselves. The derivatives return is linked to movements in the underlying assets. The assets held by the fund will mainly be in US Dollars but may be denominated in a wide variety of currencies. Non-USD denominated currency exposure is limited to 20% of total assets. The investment advisor may use foreign exchange and related derivative instruments to hedge or implement currency positions. For full investment objectives and policy details please refer to the fund’s prospectus. Distribution Policy This share class does not pay out a distribution. Any investment income generated will be reinvested. Dealing Day You can buy and sell shares on most working days in Dublin, exceptions to this are more fully described in the fund holiday calendar available from the Administrator.","The investment objective of the Fund is to seek to maximise total return, consistent with prudent investment management. The Fund invests at least two-thirds of its assets in a diversified portfolio of Fixed Income Instruments of varying maturities. The average portfolio duration of this Fund will normally be within two years (plus or minus) of an equally weighted blend of the following three indices: Bloomberg Barclays Global Aggregate Credit ex-Emerging Markets, ICE BofAML BB-B Rated Developed Markets High Yield Constrained Index, JPMorgan EMBI Global; All USD Hedged (together the “Benchmark”). The Bloomberg Barclays Global Aggregate Credit ex Emerging Markets Index provides a broad-based measure of the global developed investment-grade fixed income markets. The index does not reflect deduction for fees, expenses or taxes.",本基金的目标是在审慎投资管理的原则下赚取最高总回报（即透过深入研究及慎重考虑，确立及施行一些贯彻一致、 规律严格并具成本效益的投资的策略，以及持续监察个别证券与总投资组合的风险）。本基金将其最少三分之二的资产投资于一项由不同年期的固定收益工具（可为公司固定收益工具）组成的多元化组合。本基金可将其全部资产投资于高孳息证券（其在支付利息或偿付本金方面出现拖欠情况，或存在有关该等付款拖欠情况的迫切风险），惟获穆迪或标准普尔给予低于B 级或获惠誉给予同等评级（或若未有评级，则须获投资顾问视为具备相若质素）的证券所占资产比例不得超过10%。本基金亦可无限额投资于在经济上与新兴证券市场有连系的发行机构的固定收益工具。本基金将运用以环球固定收益为本的策略，该策略寻求运用投资顾问的总回报投资过程及理念。投资组合的构建乃基于广泛分散投资环球固定收益板块的原则。该策略专注于透过信贷质素的改善而具备资本增值潜力的基本面稳健或正在改进的证券。由上而下及由下而上的策略乃用于识别可产生稳定回报的多重价值来源。运用由上而下的策略时，会从宏观角度考虑在中期内可能影响环球经济及金融市场的各种力量。由下而上的策略则带驱动证券甄选过程，有利识别和分析价值偏低的证券。本基金可持有非美元计价固定收益工具及货币持仓（可透过金融衍生工具投资项目而受到积极管理）。非美元计价货币持仓以总资产的20%为限。,https://doc.morningstar.com/LatestDoc.aspx?clientid=magnumhk&key=4e7d32ed0acb6ed9&language=446&investmentid=FOGBR05KHT&documenttype=52&market=1447&investmenttype=1,https://doc.morningstar.com/LatestDoc.aspx?clientid=magnumhk&key=4e7d32ed0acb6ed9&language=451&investmentid=FOGBR05KHT&documenttype=76&market=1447&investmenttype=1,https://doc.morningstar.com/LatestDoc.aspx?clientid=magnumhk&key=4e7d32ed0acb6ed9&language=451&investmentid=FOGBR05KHT&documenttype=4&market=1447&investmenttype=1,https://doc.morningstar.com/LatestDoc.aspx?clientid=magnumhk&key=4e7d32ed0acb6ed9&language=451&investmentid=FOGBR05KHT&documenttype=5&market=1447&investmenttype=1,https://doc.morningstar.com/LatestDoc.aspx?clientid=magnumhk&key=4e7d32ed0acb6ed9&language=451&investmentid=FOGBR05KHT&documenttype=1&market=1447&investmenttype=1,27,68,77,80,23,0.0159,2021/6/30,0.0159,EUCA000902,2022/1/6
IE00B1D7YM41,FSGBR072BR,PIMCO GIS Global High Yield Bond Fund E Class USD Accumulation,PIMCO环球高孳息债券 - E ACC,USD,USD,0,1,90,2,1.02,0.74,-0.0171,-0.1158,0.0255,0.0815,,,,3,5169310433,2006/9/11,1000,,PIMCO Global Advisors (Ireland) Limited,,"The fund aims to prudently generate a total return through a combination of both income and capital growth. The fund invests primarily in a range of ""high yield"" fixed income securities (which are loans that pay a fixed or variable rate of interest) issued by companies from around the world. These will mainly be priced in US Dollars but the fund may also hold other currencies as well as securities that are priced in other currencies. Investments may also be linked to emerging market countries, which in investment terms are those economies that are still developing. These high yield investments have a rating lower than ""Baa"" from Moody's or ""BBB"" from S&P, reflecting the higher risk of an institution defaulting on its payments. The fund may also invest up to 20% in lower rated securities of ""Caa"" and ""CCC"" by these same agencies. These are generally considered to be riskier investments but pay a higher income. The fund's benchmark is the BofA Merrill Lynch Global High Yield BB B Rated Constrained Index (USD ). It is used to measure duration. Duration is the sensitivity of a fixed income security to a change in interest rates. The longer the duration of a fixed income security, the higher its sensitivity to interest rates. For full investment objectives and policy details please refer to the prospectus. The fund may invest in derivative instruments (such as futures, options and swaps) rather than directly in the underlying securities themselves. The derivatives return is linked to movements in the underlying asset. Any income the fund generates will be reinvested to grow the value of your investment. You can buy and sell shares on most working days in Dublin, exceptions to this are more fully described in the Fund Holiday Calendar available from the Administrator.","The investment objective of the Fund is to seek to maximise total return, consistent with prudent investment management. The Fund invests at least two-thirds of its total net assets in a diversified portfolio of high yield Fixed Income Instruments that are denominated in major world currencies and are rated lower than Baa by Moody’s or BBB by S&P or equivalently rated by Fitch. The Fund may invest up to 20% of its total net assets in high yield Fixed Income Instruments that are rated Caa or lower by Moody’s or CCC or lower by S&P or equivalently rated by Fitch (or, if unrated, determined by the Investment Advisor to be of a comparable quality). The portion of the Fund’s assets that are not invested in Fixed Income Instruments rated lower than Baa by Moody’s or lower than BBB by S&P or equivalently rated by Fitch may be invested in higher quality Fixed Income Instruments.",本基金的投资目标是以维护资本及审慎的投资管理寻求最大总回报。本基金叁分之二以上的资产投资於以世界主要货币计价且Moody’s 评为Baa 以下或S&P 评为BBB 以下(或若未经评等，则由投资顾问判断其相对品质)之高报酬固定收益C券的各种组合。本基金可将其全部资产投资於高报酬C券，但Moody’s 或S&P 评为B 以下(或若未经评等，则由投资顾问判断其相对品质)之C券不得超过其资产的5%。本基金其馀资产可投资於较高品质的固定收益C券。本基金之平均投资组合存续期间将根据投资顾问对於利率的预测而异，通常介於二至七年。本基金90%以上的资产将投资於OECD 受规管市场上市、交易或处理之C券。,https://doc.morningstar.com/LatestDoc.aspx?clientid=magnumhk&key=4e7d32ed0acb6ed9&language=446&investmentid=FOGBR05KHX&documenttype=52&market=1447&investmenttype=1,https://doc.morningstar.com/LatestDoc.aspx?clientid=magnumhk&key=4e7d32ed0acb6ed9&language=451&investmentid=FOGBR05KHX&documenttype=76&market=1447&investmenttype=1,https://doc.morningstar.com/LatestDoc.aspx?clientid=magnumhk&key=4e7d32ed0acb6ed9&language=451&investmentid=FOGBR05KHX&documenttype=4&market=1447&investmenttype=1,https://doc.morningstar.com/LatestDoc.aspx?clientid=magnumhk&key=4e7d32ed0acb6ed9&language=451&investmentid=FOGBR05KHX&documenttype=5&market=1447&investmenttype=1,https://doc.morningstar.com/LatestDoc.aspx?clientid=magnumhk&key=4e7d32ed0acb6ed9&language=451&investmentid=FOGBR05KHX&documenttype=1&market=1447&investmenttype=1,28,34,33,53,49,0.0145,2021/6/30,0.0145,EUCA000766,2022/1/6
IE00B3BC9V92,FSGBR0579N,Barings International Umbrella Fund - Barings Asia Growth Fund Class I USD Acc,霸菱国际伞子基金-亚洲增长基金 I USD Acc,USD,USD,0,1,10,1,-0.02,1.07,-0.0987,-0.1778,0.1272,0.2019,,2.05578,0.01528,5,236025249.7,2015/5/11,10000000,500,Baring International Fund Mgrs (Ireland) Limited,霸菱资产管理有限公司,"Objective: To provide long-term capital growth by investing in Asia and the Pacific region excluding Japan. Investment Policy: The fund invests at least 70% of its total assets (excluding cash and cash equivalent assets) in the shares of companies incorporated in, exercising the predominant part of their economic activity in, or quoted or traded on stock exchanges in Asia and the Pacific region (excluding Japan). - The fund is also permitted to invest to a lesser extent in shares of companies outside the Asia Pacific region (excluding Japan) as well as in fixed income securities and cash. - The fund may use derivative instruments for both investment and hedging purposes. The return on a derivative is linked to movements in an underlying instrument referenced by the derivative such as currency or interest rates. The base currency of the fund is USD. Distribution Policy: N/A - Income will be rolled up into the value of your investment. Dealing Frequency: Daily. Investors can buy and sell their shares on demand on each Business Day (as defined in the prospectus and supplement). Benchmark: MSCI All Country Asia ex-Japan (Total Net Return) Index'. The fund is actively managed and is not designed to track the Benchmark so its performance may deviate materially from the Benchmark. The investment manager has complete discretion in making investments and is not constrained by the Benchmark. The fund may invest significantly in instruments which are not included in the Benchmark. The Benchmark is used only for risk management and performance comparison purposes. The investment manager may consider, for example, issuer exposures, sector weights, country weights and tracking error in each case relative to the Benchmark but does not use the Benchmark as an investment limitation. For further details please refer to the prospectus and supplement.","The investment objective of the Fund is to achieve long-term capital grow th in the value of assets by investing in Asia and the Pacific region excluding Japan. The Fund w ill seek to achieve its investment objective by investing at least 70% of its total assets in equities and equityrelated securities of companies incorporated in, or exercising the predominant part of their economic activity in the Asia Pacific region excluding Japan, or quoted or traded on the stock exchanges in those countries, including developed and emerging markets. For this purpose, total assets exclude cash and ancillary liquidities. For the remainder of its total assets, the Fund may invest outside the Asia Pacific region (excluding Japan) as w ell as in fixed income and cash.",本基金的目标是投资於一个多元化的亚洲股票投资组合，以达至资产值的长期资本增长。,https://doc.morningstar.com/LatestDoc.aspx?clientid=magnumhk&key=4e7d32ed0acb6ed9&language=451&investmentid=F00000NGLT&documenttype=52&market=1447&investmenttype=1,https://doc.morningstar.com/LatestDoc.aspx?clientid=magnumhk&key=4e7d32ed0acb6ed9&language=451&investmentid=F00000NGLT&documenttype=76&market=1447&investmenttype=1,https://doc.morningstar.com/LatestDoc.aspx?clientid=magnumhk&key=4e7d32ed0acb6ed9&language=451&investmentid=F00000NGLT&documenttype=4&market=1447&investmenttype=1,https://doc.morningstar.com/LatestDoc.aspx?clientid=magnumhk&key=4e7d32ed0acb6ed9&language=451&investmentid=F00000NGLT&documenttype=5&market=1447&investmenttype=1,https://doc.morningstar.com/LatestDoc.aspx?clientid=magnumhk&key=4e7d32ed0acb6ed9&language=451&investmentid=F00000NGLT&documenttype=1&market=1447&investmenttype=1,75,84,46,26,5,0.01,2021/10/31,0.0075,EUCA000779,2022/1/6
